<?xml version="1.0"?>
<population annÃ©e="2013" xsi:noNamespaceSchemaLocation="./populationML.xsd" xmlns:xsi="http://www.w3.org/2001/XMLSchema-instance">

    <pays Code="DJ" continent="AF">
        <nom>Djibouti</nom>
        <population>792000</population>
    </pays>
    <pays Code="FR" continent="EU">
        <nom>France</nom>
        <population>65951611</population>
    </pays> 
    <pays Code="MA" continent="AF">
        <nom>Morocco</nom>
        <population>32940000</population>
    </pays>
</population>
